product_id,name,category,brand,price,cost,description,rating,review_count,in_stock,stock_quantity,launch_date
PROD_000001,Reactive grid-enabled product,Electronics,"King, Wright and Reynolds",937.31,74.62,Water travel feel. Suggest remember home road generation place. Name practice TV main scientist type.,4.0,243,False,21,2023-04-18
PROD_000002,User-centric clear-thinking parallelism,Electronics,"Villarreal, Herrera and Roberts",823.44,336.66,"Side agreement charge which play. Offer position his.
Newspaper country help least. Second wrong including weight ability young second trip.
Specific TV care support. Card recognize detail party.",3.9,343,False,0,2022-12-03
PROD_000003,Fully-configurable zero-defect hardware,Clothing,Ellis Group,257.04,38.56,"Think cell speak spend body himself. Seem here at once seek same poor. Plant green serious police magazine just surface enjoy.
Part ago until why try. Follow win sea free as reveal decade.",2.0,110,True,0,2023-07-26
PROD_000004,User-centric tangible artificial intelligence,Home,Parks-Carter,735.25,484.71,"Group boy recent open. Military operation first as themselves account add.
During many itself believe create. Source maybe art rich movie whole beat. Old foot voice economic item.",4.5,504,False,48,2024-12-11
PROD_000005,Digitized interactive paradigm,Electronics,"Gonzalez, Middleton and Griffith",830.51,395.42,"Conference sea activity almost continue. Continue maybe them. Travel affect for store collection scientist.
Small agree important already fire. Floor open center believe teacher.",3.3,776,True,9,2022-07-27
PROD_000006,Compatible bifurcated task-force,Electronics,Scott LLC,301.95,162.76,"Office court politics hair military. Someone citizen run effect.
Four describe control hundred significant. Participant into above enough mention. Cover community approach special week easy.",4.8,75,False,48,2022-11-26
PROD_000007,Fully-configurable scalable migration,Clothing,Harvey Group,734.66,275.79,Black list yeah despite identify. Recently city there since we under hour rest. Full night recognize record imagine.,4.6,95,False,78,2024-06-08
PROD_000008,Assimilated incremental toolset,Home,Long PLC,707.45,218.51,"Not opportunity door part threat. Skin baby benefit team purpose matter big.
Reason because each market decade. Here likely coach store. Wall event party.",3.6,621,False,12,2022-12-04
PROD_000009,Total explicit hardware,Books,Harris-Cabrera,213.48,99.04,Least security one southern. Tonight activity house of measure professor year body. Reflect himself factor least per later. In threat difference.,3.8,739,False,38,2025-03-08
PROD_000010,Operative mission-critical protocol,Clothing,Krueger LLC,104.95,199.49,"Example stay nation reality. Rock western ten management. Also yes training before hundred.
Pressure opportunity price sign answer find together claim. Character no think.",3.2,502,True,0,2023-09-16
PROD_000011,Total mission-critical open system,Electronics,"Davis, Hood and Hebert",433.32,150.8,"Tv him bag skin between. So break theory site.
Radio unit stage you field less test claim. New pretty eye budget subject least place.",3.6,614,False,3,2023-05-03
PROD_000012,Customizable stable implementation,Clothing,Patton LLC,179.11,149.45,"Political budget exist answer report. Turn design anything others.
Home image education general. Your compare pretty science. Ability plan executive result.",1.3,864,True,50,2022-10-01
PROD_000013,Self-enabling tangible superstructure,Home,Reynolds-Bailey,494.2,332.21,"Hand sing fast certainly wrong. Point beat choose identify set gun happen. Him account against amount family.
Stuff above stand meeting. Technology end skin mention sing bill.
Why wonder in.",1.4,557,False,48,2023-04-07
PROD_000014,Inverse coherent moderator,Books,Howard PLC,194.71,27.09,Father ability begin risk never laugh sort direction. Relate very get ahead. Create whose want until clearly poor. Capital stay social join brother record professor what.,2.8,269,True,72,2023-05-03
PROD_000015,Seamless full-range task-force,Electronics,Buchanan PLC,159.61,349.75,"Explain new son explain this. Nearly compare political purpose.
Against develop general wonder nice. Purpose dinner next. Property best station per. Economy truth dream result other add.",1.4,684,False,52,2022-08-19
PROD_000016,Business-focused human-resource groupware,Sports,Stevens-Hall,235.23,35.19,"Know amount human century increase unit. Professional attorney onto necessary cause detail.
Exactly look huge party policy support fast.",2.5,535,False,87,2023-12-20
PROD_000017,Visionary 5thgeneration focus group,Home,Gibson and Sons,576.98,121.64,"Result garden walk huge. Foreign full learn suffer.
His street none. Address everyone hard article you defense. Per full outside grow. Summer focus Mrs special moment.",2.2,404,True,66,2023-04-26
PROD_000018,Diverse radical challenge,Sports,Johnson Inc,680.75,312.04,Must shoulder toward grow drive compare image. Decide teach strong how worry standard seem will. Stuff only matter few.,1.5,775,False,21,2024-05-17
PROD_000019,Optional bandwidth-monitored implementation,Clothing,Lopez LLC,810.37,67.46,"Record ask science government outside. Road often perform. Dinner experience sister risk.
Sea bar his physical. Trouble move away former face safe study.",2.7,699,False,80,2024-09-16
PROD_000020,Cloned clear-thinking algorithm,Clothing,"Moore, Miller and Graves",835.76,132.65,Natural image avoid return art car attorney. Hospital personal quite kid. Pick local into friend career cup.,4.6,936,True,0,2024-01-17
PROD_000021,Total coherent encryption,Sports,"Terry, Clark and Green",403.37,166.43,"Probably maybe herself partner camera long who require. Make network soon market. Now think future decision model among.
Project air hold good red. Fall issue tend theory the hard.",2.1,469,True,79,2023-10-03
PROD_000022,Implemented optimizing interface,Sports,Martin PLC,527.33,212.7,"Store against image catch accept including. Wife industry him up.
Stand approach instead call. Then represent conference war science reduce pass.",2.7,151,True,72,2024-02-18
PROD_000023,Devolved holistic budgetary management,Electronics,"Carter, Rios and Stevens",787.88,434.4,"Power morning behavior laugh quite. Similar cover population thing.
Recognize especially ask two major she knowledge. Culture picture provide support six space.",4.5,898,False,83,2023-01-25
PROD_000024,Organized systematic orchestration,Home,Johnson-Tyler,576.29,239.16,Painting material science beat deal across friend. Paper experience itself trouble card.,1.7,412,True,87,2024-10-16
PROD_000025,Progressive transitional solution,Home,"May, Fernandez and Williams",48.38,445.34,Officer serious same experience point article article. Ask if throw future reach. Course plant billion middle describe financial.,2.3,243,True,34,2023-01-16
PROD_000026,Total bi-directional Internet solution,Books,Rodriguez PLC,30.02,409.61,Wonder military institution be number step. Just often require dark current including. Thank rest ten four without debate couple.,2.2,287,False,87,2024-06-22
PROD_000027,Quality-focused encompassing interface,Electronics,Kelley-Jacobs,972.76,117.84,"Spring simply according. Game citizen stay condition senior involve nice.
First point specific report clearly. Themselves have feel blood.
Sound level couple. Movement nor line.",2.2,761,False,41,2025-03-11
PROD_000028,Versatile bifurcated capability,Books,"Carter, Flores and Steele",731.5,304.46,Tv cup sister article kind bar available. Respond everything cover push. Describe question appear school low start production.,1.4,452,True,52,2024-12-29
PROD_000029,Ergonomic executive time-frame,Home,Smith-Gilbert,761.89,434.26,"Claim station example catch. Radio hair sister person whatever consumer. Often set during perhaps.
Again really long during anyone box manage.",4.3,527,True,0,2023-01-15
PROD_000030,Intuitive executive middleware,Sports,"Reeves, Howard and Kline",409.34,391.36,Blue now line before. His wife represent under world. Table quickly drive choose theory before. Realize stage imagine half single center hotel.,3.1,582,True,25,2024-06-06
PROD_000031,Multi-tiered 3rdgeneration functionalities,Electronics,Lawrence PLC,256.99,230.94,"Decade century theory husband prepare. These receive cup doctor. Suddenly travel high require strategy customer.
Trade arm also appear.",4.7,721,True,59,2024-07-20
PROD_000032,Sharable leadingedge instruction set,Sports,Davis-Townsend,402.96,461.92,"Move poor mention specific. World purpose investment at. Field learn recently eight leader about girl.
Year tell because woman. Water purpose score across party market dark.",3.7,247,False,57,2025-04-22
PROD_000033,Open-source disintermediate Internet solution,Clothing,"Fox, Ortega and Howard",960.91,239.92,"These site claim under commercial city. It kitchen store method now reach.
Beat house stage college nearly political. Whose a fact on space not blood. Game live let its window structure.",3.2,352,True,33,2024-02-01
PROD_000034,Ergonomic object-oriented architecture,Electronics,Lawrence LLC,292.21,196.35,Soon move kid possible success final. Always their guess analysis responsibility contain. Organization police mission language structure.,1.7,585,True,82,2022-07-16
PROD_000035,Grass-roots composite orchestration,Clothing,Morales Ltd,680.91,138.2,Chance Congress dinner country painting start. Administration collection among site material crime wait. Size toward prepare interest employee. Later dream war same explain agent speak.,2.6,20,True,16,2024-05-25
PROD_000036,Reactive national protocol,Clothing,Gomez-Sawyer,605.12,9.19,Media skill no task product. Pressure war picture take story democratic.,2.0,824,False,90,2025-05-11
PROD_000037,Optional radical solution,Books,Delacruz-Johnson,429.56,191.36,"Five arrive yes all company.
Less run account leader exactly truth. Serve note recent land trip majority center will.",2.4,258,True,86,2025-04-23
PROD_000038,Cross-platform fault-tolerant database,Sports,Perez-Brown,826.06,201.59,Enter raise public discussion difference man teach serve. Bad return town born dream. Office ever than husband continue leave.,1.4,523,False,76,2023-06-25
PROD_000039,Implemented global artificial intelligence,Sports,Welch-Reynolds,289.84,343.78,"Statement personal once food bad program type general.
Sense detail law all share career. Name blue lay easy. History young cell beautiful fish.",2.9,344,False,35,2022-09-06
PROD_000040,Optional disintermediate adapter,Books,Leblanc PLC,659.55,476.33,"Job management arrive friend. Return start music truth by quality. Key quality beyond community set exactly.
Turn most although maybe sure bed factor. Arm hard staff husband.",3.6,192,True,30,2023-01-05
PROD_000041,Configurable multi-state strategy,Electronics,Lucas and Sons,807.37,402.17,"Head trip be although president church wonder low. Question blue administration chair. Boy pull life call tough whether speak travel.
Meeting success center pass. Room major star.",3.4,676,False,92,2024-02-16
PROD_000042,Synergized local matrix,Electronics,Ramos LLC,658.84,498.75,Scientist subject ball tell argue ever anything speak. Accept simply help southern. Night never alone defense vote.,2.0,428,False,4,2024-08-08
PROD_000043,Front-line zero tolerance interface,Sports,"Wagner, Williams and Oneal",710.98,288.16,"Land author the finish. Each heart beyond financial chance. Dog price college someone.
Side science rate. Thing public mission rich.",1.8,743,True,81,2024-10-09
PROD_000044,Phased 24/7 knowledgebase,Home,Hamilton LLC,907.45,337.57,The agree pressure mouth parent bit. Learn more ball body sit. Performance sometimes fight employee.,3.0,865,True,71,2024-12-01
PROD_000045,Vision-oriented leadingedge moratorium,Clothing,Case LLC,300.84,238.04,"Debate better name system local expert yeah. Role design pretty response. Project which few skin though.
Interest road a week book south indicate. Range company provide hear.",4.0,742,True,42,2025-05-12
PROD_000046,Networked optimizing migration,Electronics,Mcintosh-Robinson,230.02,115.55,"Single discuss agreement must main owner political. Rock real bad general wish section. Single religious way box.
Various himself our exactly analysis enough help. Often bank later campaign.",4.5,430,False,74,2024-12-09
PROD_000047,Programmable solution-oriented extranet,Books,"Woods, Mitchell and Mendez",469.11,63.3,Arm claim than blood buy evidence table so. Green scene need movement bill wait. Item manage place. Image during year customer behind others.,1.2,649,True,24,2024-11-25
PROD_000048,Proactive asynchronous interface,Sports,Bailey-Pope,128.61,341.95,"Home sort reality instead. Sort drug like technology.
Official senior animal ready strong. Live clear ground fast middle. Me game inside whose test quite.",3.1,423,True,19,2024-07-16
PROD_000049,Enterprise-wide tertiary core,Clothing,Shepherd-Martinez,992.41,174.62,Do our group best debate significant. Five behind hope simply owner. Thus song our.,4.9,914,False,91,2025-04-08
PROD_000050,Cross-group intangible initiative,Clothing,"Brown, Wiley and Lewis",781.14,246.35,Court investment agreement realize building prevent religious. Relationship Congress car. Position same war behind. Modern social return specific article purpose early safe.,3.5,181,False,0,2024-09-10
PROD_000051,Adaptive tangible policy,Home,Gonzales-Bell,280.78,381.79,Property method price woman. Writer account sort expect final goal.,1.7,782,True,97,2025-04-20
PROD_000052,Front-line mission-critical implementation,Electronics,"James, Aguilar and Zuniga",138.1,219.69,Community collection get discuss himself notice behavior assume. Site court quality structure soldier situation figure. President teach family her pull.,2.7,439,False,4,2022-12-16
PROD_000053,Fully-configurable upward-trending open architecture,Sports,Reyes PLC,207.41,189.69,Form again especially future strategy officer girl. Plant very southern writer participant these TV.,1.1,329,True,0,2023-08-21
PROD_000054,Multi-tiered multi-state Internet solution,Electronics,Cole-Ryan,630.41,128.17,"Lead impact blood record talk. The term item. Be end key. Ball white Democrat model.
From lose grow it. A full myself measure want rather. Man fall none rich Congress exist.",3.8,352,False,49,2024-07-21
PROD_000055,Focused mobile Graphical User Interface,Sports,Williams-Summers,592.77,87.67,"Somebody itself likely reflect. Cold former knowledge feel almost candidate argue television.
Food relationship make season sense themselves feeling. Pick set economic positive.",4.3,305,False,66,2024-11-06
PROD_000056,Streamlined demand-driven ability,Sports,Day-Gordon,528.87,219.66,Trade tough majority go. Serve any democratic foreign chair war. Democratic fight example pick election meet.,3.7,137,False,62,2023-03-02
PROD_000057,Object-based leadingedge monitoring,Books,Horton-Hicks,752.6,86.62,Major many situation whom teach party range practice. Stuff require catch government couple. Skin there thank while six live letter.,4.6,831,False,0,2024-08-10
PROD_000058,Distributed disintermediate synergy,Clothing,Bowen-Cooper,729.89,69.95,Pressure institution early west trial ten. Walk involve all raise. Technology already letter.,3.9,603,True,91,2024-09-04
PROD_000059,Organized zero tolerance focus group,Electronics,Simmons-Collins,381.43,321.96,Large type member shake impact main a. Run in provide teach street natural chair.,4.1,638,True,6,2023-09-12
PROD_000060,Distributed asymmetric extranet,Electronics,Gomez and Sons,657.02,14.77,"Home allow machine late during necessary study. Law scientist fund end federal.
Able force energy billion. Trouble difficult mean population.",3.8,426,False,70,2025-04-07
PROD_000061,Operative zero administration functionalities,Books,"Briggs, Bailey and Tapia",479.64,80.8,Half cold budget nearly foreign theory southern. Speak mission relationship quality. True wife network heart.,3.8,645,True,84,2023-08-03
PROD_000062,Fundamental clear-thinking strategy,Electronics,"Hendrix, Thompson and Melendez",665.85,138.64,"Then off season drug several appear onto type. As fire line cover.
Fast husband cultural base. Gun support weight fly although arrive.",3.4,140,False,13,2024-07-21
PROD_000063,Front-line value-added website,Sports,Nguyen-Mercado,721.57,63.28,"Score contain opportunity center voice tax our. Check indicate range various true sound.
Will truth security word herself past.
Time thousand sure risk.",1.5,108,False,25,2024-04-30
PROD_000064,Proactive heuristic productivity,Books,Jackson-Casey,833.17,486.69,Single west air cover even of usually. Second action notice cause. Manage set necessary lay region citizen. Another population leg.,2.4,419,False,70,2025-01-31
PROD_000065,Stand-alone 3rdgeneration strategy,Home,Mcintyre PLC,911.24,345.66,"South analysis need. Social story energy industry. Suggest though enjoy west human woman.
Responsibility age that. Will once form hot reach daughter behind. Forget subject issue care method man.",2.9,240,True,0,2024-08-11
PROD_000066,Ergonomic next generation implementation,Electronics,Weeks Group,907.8,418.44,"Program language think send past. Meeting debate building return eight. Only wrong follow early collection responsibility face. Operation send employee speak.
Do key night open third whatever.",3.7,152,True,9,2024-01-14
PROD_000067,Enterprise-wide cohesive moderator,Electronics,Love Inc,905.72,323.95,"Despite early decide join member garden movement. Race story machine important manager.
We everything soon despite wind safe off store.",2.8,1000,False,6,2024-06-25
PROD_000068,Diverse interactive intranet,Electronics,Hodges-Combs,815.04,437.7,"Peace interesting free environmental image skin author group. Financial born idea morning interview very.
Not deal say.
Strong how court also. Offer present choice two certain modern.",4.4,368,False,14,2023-05-01
PROD_000069,Adaptive asynchronous groupware,Electronics,Gonzales and Sons,852.72,445.69,"Human would magazine up for evening thing. Each child hotel past join talk. Plan case carry pick see house.
Of blood real report start give know phone. Sort hair amount wonder.",1.0,141,True,56,2024-12-03
PROD_000070,Mandatory attitude-oriented secured line,Sports,"Terry, Hurley and Lawson",275.62,367.87,"Low have check quality everyone benefit fill. Fund public investment every.
Mind pull each sister. Production live key its here five. Loss gun field.",2.5,350,True,51,2023-04-30
PROD_000071,Customizable grid-enabled database,Home,Wheeler-Owens,279.1,195.93,"Body wear poor.
Teach short pass enjoy production stand process. Low common wall life matter husband billion. Establish whom plant finally hour forget.",4.4,819,False,21,2023-08-22
PROD_000072,Distributed zero tolerance moderator,Electronics,Fuller-Wilson,141.18,364.57,"Cold degree save skin point know. Adult big hundred or wish.
Role manage operation result southern. Wind buy glass floor future.
Require material exist research I but agent.",4.9,864,True,75,2024-11-11
PROD_000073,Front-line static neural-net,Home,"Coleman, Morales and Wright",804.23,340.8,"Main drive these somebody reflect organization. Major lawyer car.
Establish be degree song star. Partner avoid couple page treat. Close play wish dinner if.",1.7,388,False,87,2022-06-19
PROD_000074,Business-focused logistical service-desk,Clothing,"Perez, Diaz and Fuller",488.24,246.62,Sport hope agent company sure consider yard. Down role special watch remain son. Though tell mission investment.,4.6,451,True,0,2024-04-26
PROD_000075,Future-proofed homogeneous hub,Books,"Lewis, Brooks and Fuentes",22.23,434.82,"Under body best significant mother. Be high late memory adult full.
Need possible music real describe. Message sister Mr today technology voice.",3.1,761,True,85,2023-08-07
PROD_000076,Exclusive 24hour migration,Books,Johns-Foster,523.9,345.68,"Traditional animal of yard product low board. Down let certain page able inside lot.
Control behind challenge example model might. Any feel may sport develop difficult still.",3.5,443,True,84,2023-03-08
PROD_000077,Re-contextualized 5thgeneration open system,Home,"Mckinney, Tucker and Smith",157.16,414.09,"From product boy which. Radio but attorney tell next between however.
Often let action everyone. Whether two attack eat. Rock sit game commercial somebody cell.",4.6,627,True,0,2023-12-10
PROD_000078,Innovative content-based software,Clothing,"Fowler, Smith and Cox",510.5,237.3,"Surface lose full effect off sign. Business then same fight traditional share.
Each beautiful form message play religious not. Use fund serve.",3.0,169,True,41,2023-10-21
PROD_000079,Synchronized intermediate approach,Clothing,Hughes and Sons,337.58,142.69,"Walk prevent research onto respond put. Successful police line door direction.
Oil inside stock rise four. To enough than break a myself to.
Field their keep soon such must yard hit.",3.0,563,False,30,2023-05-09
PROD_000080,Organized high-level frame,Electronics,"Paul, Barnes and Murray",464.49,401.62,"So charge hold office fast full wall. Serve oil participant. What herself teach score activity.
Rich rock consider tend practice television. Despite car important natural. Person television third.",2.8,877,False,15,2022-10-27
PROD_000081,Right-sized intangible conglomeration,Home,Guerrero Inc,747.78,13.8,Whom president collection cut discussion range simply. Skin democratic operation. Edge here skin sport threat.,2.6,36,True,77,2024-01-10
PROD_000082,Realigned global forecast,Sports,"Mendoza, Valentine and Sanchez",641.15,445.6,"Place share minute act coach glass financial century. Food window improve.
Half song look teacher. Nearly point land however quickly among.",3.2,670,False,46,2022-11-26
PROD_000083,Integrated non-volatile hierarchy,Electronics,Thompson-Roth,818.41,422.94,"Hot feel interview doctor set my media. Above food reduce condition maintain full bad. Chair city reflect.
Rich major father water.",2.3,785,False,46,2022-09-22
PROD_000084,Down-sized impactful software,Home,"Duncan, King and Jackson",122.87,380.86,"Test huge loss training game.
Cut of head weight center. Read democratic movement popular international. Ten friend within child.",1.9,349,False,37,2024-06-09
PROD_000085,Assimilated regional capacity,Sports,Jones-Anderson,526.76,352.54,"Choice rich good draw relate wide last. Story offer surface.
Future claim travel gas who place head follow. Back success soon position. Executive close affect skin.",1.2,168,False,91,2023-10-12
PROD_000086,Virtual secondary Internet solution,Home,"Clarke, Castillo and Macias",115.88,307.37,"Course figure picture garden fight. Million close window heavy live front image.
Thus term positive strong party. Another south establish move affect father fall.",1.8,952,False,100,2024-04-26
PROD_000087,Centralized bandwidth-monitored service-desk,Clothing,Hernandez-Allen,719.61,58.34,"Continue consider financial assume man term inside. These plant miss.
Something design form month say large fill citizen. Pm street while positive follow individual indeed.",2.7,948,True,57,2022-06-24
PROD_000088,Automated tertiary productivity,Home,Reynolds Group,661.86,478.31,Ten population feeling later. Economic scene foot employee voice research exist. By people out right seek.,1.5,510,True,6,2024-11-29
PROD_000089,Profound bandwidth-monitored definition,Sports,Smith Group,935.95,420.21,"Future pick study decade Congress. Institution big condition fall little.
Plant much course. Church drop get food authority answer eat.",2.9,520,True,22,2024-05-16
PROD_000090,Synergized systematic framework,Clothing,Long-Jones,112.51,330.47,Choose spend task capital discussion song along main. Away before economic with wind generation again. Role financial which use wind. Require like four market series group we thus.,3.4,329,False,77,2023-07-11
PROD_000091,Universal intermediate encoding,Clothing,Anderson-Sawyer,280.85,481.98,"Job available among child fire none history.
Other leave back couple democratic who. Tree measure seat. Also analysis trouble she individual benefit anyone describe.",4.9,463,True,77,2024-07-21
PROD_000092,Upgradable heuristic array,Sports,"Roth, Gomez and Fisher",305.91,352.24,"Year physical produce. Free hundred news serve herself compare. Activity we research. Station right work both.
Child cover decision information adult middle road. Where develop shoulder.",4.4,728,True,79,2023-05-06
PROD_000093,Optional 6thgeneration hardware,Books,"Lawson, Diaz and Morales",689.74,460.99,"Unit become any personal keep. Use administration allow glass strong get former social.
Region lot drop quality between manager newspaper. Option claim indeed he.",1.5,727,True,88,2024-02-14
PROD_000094,Reactive demand-driven open system,Books,Morales-Ellis,713.24,381.58,Long finally best Democrat dark soldier example. Detail provide agree oil fact fine past. View worry man wind everyone join nothing which.,3.2,596,False,68,2023-04-17
PROD_000095,Multi-layered homogeneous synergy,Books,Hayes-Charles,878.69,214.08,"Growth process million say. Bill might pick sign medical.
Attorney I analysis my boy conference.",1.1,109,True,6,2022-08-30
PROD_000096,Multi-lateral 6thgeneration definition,Electronics,Monroe Inc,207.89,376.34,"Receive herself herself. Speech turn small page eat off according be. Lawyer site begin may street.
Sport sound past safe. What put central field main nice.",1.6,293,False,7,2024-05-01
PROD_000097,Integrated 24/7 Graphical User Interface,Books,Terry and Sons,211.95,272.88,"Player knowledge onto able find although. Increase occur ever answer yourself hit.
Produce me money attorney cup. Speak government treat even listen.",2.4,463,True,86,2023-03-04
PROD_000098,Customer-focused tertiary emulation,Sports,Adkins-Duarte,866.18,372.49,"Control picture white audience. Admit cold service late do assume.
Girl understand however. Rate already ago move. Popular far skill close difficult also.",3.2,243,False,6,2024-03-15
