product_id,name,category,brand,price,cost,description,rating,review_count,in_stock,stock_quantity,launch_date
PROD_000099,Profound eco-centric model,Home,Mcdonald Ltd,393.67,478.57,"Space agent approach throughout something about. Know wear she develop.
Off finally culture dark wrong already. Billion use available blood region institution appear. Everyone age two.",4.9,320,True,0,2025-03-17
PROD_000100,Multi-layered cohesive emulation,Books,"Duke, Castillo and Frazier",211.05,435.08,"Growth trade theory serious find. On his identify girl rest response whatever party.
Billion lawyer which than shake. Event manager reveal upon. Society speech state suffer heavy.",4.4,453,True,90,2023-07-12
PROD_000101,Realigned secondary attitude,Books,Salas-Summers,757.55,275.57,By thing building carry agency recently onto partner. Seek hotel husband standard movement other. Big fast with.,3.4,794,True,22,2023-06-02
PROD_000102,Secured context-sensitive info-mediaries,Electronics,Smith Ltd,195.1,91.03,"Project seek bar force. Indeed suffer least no.
Phone bank way talk ability pull new cause. Most field will strategy person.",3.1,386,True,71,2023-09-09
PROD_000103,Robust client-driven capacity,Books,Barton PLC,138.76,294.07,These again degree bank. State business his point physical response. Choose including share.,2.0,338,False,19,2024-03-31
PROD_000104,Secured non-volatile Graphic Interface,Electronics,Mayer LLC,162.16,164.7,Increase either feeling minute set eat two picture. Itself both will break finally wife determine.,1.2,954,False,73,2023-07-02
PROD_000105,Cross-platform system-worthy collaboration,Sports,Reeves LLC,364.49,393.1,Life break condition right however. Describe couple meet. Movement according performance general.,2.3,225,True,100,2022-09-29
PROD_000106,Diverse high-level open architecture,Sports,Cross-Martin,167.77,273.82,"Someone myself gun. Allow way record official coach.
Cause letter which stuff commercial book thousand. Modern bar PM director interview good try.",2.6,357,True,84,2023-08-14
PROD_000107,Cloned cohesive process improvement,Books,"Cross, Gomez and Davis",337.75,150.32,"Whatever those allow.
Field Mrs eight can investment common real actually. Action later can focus child pressure.
Relate couple even. Theory policy culture lead.",4.8,633,False,96,2024-02-08
PROD_000108,Upgradable systematic function,Electronics,Wright Inc,123.56,176.27,"Everything education wall hope job enough. Above rate explain small former agree forget.
Imagine central war store color about can. Budget accept stand pressure.",2.0,657,True,87,2023-06-25
PROD_000109,Future-proofed user-facing approach,Books,"Rosales, Torres and Carney",387.55,399.12,"Second put other another blood break. Simply stage floor rate strong leg.
Mrs I determine work everybody onto wide. Effort white sort. Through medical religious or brother myself attack.",1.5,262,False,0,2024-08-22
PROD_000110,Multi-channeled non-volatile installation,Sports,Morris-Crawford,823.88,190.6,Blood could last or. Difference remember serve life will kind economic. Because home near without. Whose now treatment although series there.,4.2,456,False,0,2024-06-12
PROD_000111,Sharable object-oriented model,Clothing,"Williamson, Perez and Mcdaniel",327.1,45.76,Hospital black bring east student. Sense look this suffer call black trade foreign. Various treatment task detail minute magazine.,1.4,994,True,26,2023-12-03
PROD_000112,Horizontal reciprocal paradigm,Clothing,"Atkinson, Bender and Valdez",866.29,214.98,"Fine range politics education son. Book white later ok stock.
History side gas pressure. Shoulder store year board hospital. Economic often try decide particularly.",1.4,550,False,9,2025-04-18
PROD_000113,Expanded analyzing intranet,Clothing,"Santiago, Drake and Larsen",33.51,359.85,"Behind TV PM cover price politics. Man movement hold. Chance culture represent focus.
Tough impact onto future west.",1.2,75,True,32,2024-07-02
PROD_000114,Ergonomic client-driven capacity,Sports,Adams Group,79.73,411.7,"Interest partner though one report. Happy reason would among word already.
Like available individual finally. Nor son son book civil necessary. Until others what challenge quality.",4.6,417,False,51,2025-05-14
PROD_000115,Streamlined disintermediate projection,Home,"Chen, Diaz and Phillips",323.23,197.8,Reason eat above either hard specific future. Anything wide defense four according marriage. Paper public type describe position major tax.,1.5,6,True,74,2025-04-24
PROD_000116,Re-contextualized 3rdgeneration contingency,Electronics,"White, Brown and Wallace",703.86,40.93,Hundred leader painting. Poor trouble agency return what question. Although debate summer education.,4.7,108,False,38,2022-11-28
PROD_000117,Operative 6thgeneration approach,Sports,"Martinez, Thomas and Hall",95.63,383.81,"Security consider single firm per food. Movement knowledge coach natural certainly hundred character. Store section ago bad you instead officer.
Else region hand often case.",2.8,404,True,68,2023-07-08
PROD_000118,Extended local neural-net,Clothing,Neal-Harrison,145.01,198.54,"End kid special recognize evening fish life. Yes beat toward. Matter law TV nation choice mission somebody.
Someone chair husband rest religious sense either. Agree game tend avoid middle interest.",4.2,558,False,18,2023-07-07
PROD_000119,Multi-layered systematic software,Books,Miller-Ross,680.51,457.51,"Officer beat pattern race.
Mission able reflect. Ability method rich hundred the bill color. Level billion we likely expect expect different.",4.2,746,False,1,2023-06-23
PROD_000120,Horizontal non-volatile leverage,Sports,Parks Ltd,876.01,74.98,Compare bank wrong common top likely toward so. Especially leave realize professional view policy test.,1.2,586,False,10,2024-08-02
PROD_000121,Organic explicit analyzer,Books,"Rosales, Davis and Villanueva",217.94,372.01,"Learn sit partner discover know. Someone how of situation part here.
Short above morning gas short space. Feeling price son minute past hospital meeting.",3.9,216,False,65,2024-03-01
PROD_000122,Optional demand-driven contingency,Clothing,Brooks-Sanchez,169.33,114.29,Say body top bed while treat. Head realize audience move improve interest memory.,4.3,198,True,72,2025-05-02
PROD_000123,Proactive stable challenge,Electronics,Rogers LLC,852.86,466.52,"Step state military this machine social ten. Cell ask serve example will effort rock evidence.
Above company easy lay billion return. Radio would they ball involve.",5.0,472,True,8,2025-04-03
PROD_000124,Managed explicit focus group,Books,Hunt-Stephenson,107.21,364.17,"Dog above truth unit. Reveal ok reality defense.
While itself receive four yard write.",2.9,338,False,83,2024-11-12
PROD_000125,Assimilated stable instruction set,Clothing,Austin-Stone,109.03,311.66,"Bill along religious last under. Easy defense key push space. Attack including possible expect lead them industry.
Candidate baby myself add. Suggest newspaper major serve answer house back.",4.6,325,False,78,2022-12-16
PROD_000126,Devolved asynchronous concept,Books,"Mills, Fernandez and Reynolds",696.51,80.44,"Street party hope two paper seven.
May choose realize mouth expert third foreign. Drug prove style.
Music term least society senior cold second truth. Test war mission woman camera.",3.3,827,False,21,2024-06-05
PROD_000127,Focused directional flexibility,Electronics,"Schultz, Li and Webster",320.07,393.9,"Drug three community west can sound stuff. Popular short argue former fund ground once. Article call left seat protect.
Nearly staff special type. Fine clear effort.",3.8,656,False,46,2024-12-28
PROD_000128,Cloned high-level toolset,Clothing,"Fisher, Mueller and Mitchell",682.77,169.12,"Month success worry gas participant. White everything provide today second. Material direction cost condition summer who.
Name form movement truth just. Process institution claim.",2.9,456,False,62,2023-02-07
PROD_000129,Multi-channeled interactive neural-net,Sports,"Brown, Vance and Kelley",117.73,324.55,"Must admit bring. Deal exactly space for learn.
Make memory leave your unit hand issue. Happy recent ok today government manager nothing particularly.",1.3,287,True,25,2025-03-25
PROD_000130,Persevering static time-frame,Books,"Brewer, Mason and Hampton",736.2,315.18,"Practice benefit attack pick continue federal. Man report floor art daughter smile.
Piece share think leg agent room natural. Week country rock raise drop.
Scene expect yard act. Old your job face.",3.9,913,True,80,2022-12-04
PROD_000131,Polarized object-oriented functionalities,Electronics,"Carroll, Zimmerman and Campbell",814.51,291.56,Tree because song pretty toward foot image beat. Beautiful whom box son scientist role do song. List dark over rate it compare.,4.1,217,True,69,2024-02-11
PROD_000132,Diverse regional moderator,Sports,"Williams, Gardner and Rice",477.37,388.72,"Here include special citizen bring occur put than. Message audience describe.
Who risk recent behind where do. Thing personal major yard wind represent. Treat be teach design.",2.5,228,False,64,2022-08-29
PROD_000133,Programmable methodical throughput,Sports,Cooper-Mckenzie,99.64,185.11,Get reflect group teacher learn difficult stay. Brother ago cultural marriage politics. Behavior win public with.,1.0,244,True,17,2024-04-02
PROD_000134,Open-architected radical infrastructure,Home,Parks-Sanchez,167.62,285.35,"Design leave ahead blue race. Standard sit oil term assume pretty nice.
Consumer fear such sometimes image. Sing fall think my moment cover themselves.",3.3,893,True,61,2023-04-03
PROD_000135,Intuitive bifurcated data-warehouse,Books,"Hammond, Shannon and Blevins",50.01,381.93,"Try mind close seem into.
Training natural major how none play certainly. Mother allow reason in keep. Find inside son military scene want entire.",1.9,270,False,85,2023-03-11
PROD_000136,Configurable holistic intranet,Clothing,Stephens Ltd,522.7,396.77,Reflect through authority much brother. Hit all cup heart become.,2.6,939,False,5,2023-08-30
PROD_000137,Optimized 4thgeneration access,Books,Riddle Inc,112.18,484.38,"Western poor case market change determine mission son. Trade reach real prepare risk she season.
Something discussion happen skill area ok. Late woman one else sit painting be raise.",3.5,280,False,72,2023-11-22
PROD_000138,Re-engineered full-range structure,Clothing,"Ray, Walter and Martinez",382.88,192.37,"West effort party hit office family structure wonder. Successful recently government itself listen collection account.
Increase us threat thousand.",3.4,919,True,48,2025-02-27
PROD_000139,Profound real-time matrix,Clothing,"Davis, Sosa and Phelps",521.2,179.68,"Knowledge let whole billion.
Player full if avoid school. Task them sing. Feeling example recognize table community relationship PM. Finish go change you spend.",4.5,498,False,0,2024-02-11
PROD_000140,Upgradable upward-trending architecture,Sports,"Grimes, Choi and Moyer",883.2,222.75,Everyone usually very maintain officer break indicate away. Election high power whose yourself task. Art office guy field rule.,1.9,526,False,23,2024-02-10
PROD_000141,Upgradable modular knowledgebase,Clothing,Brown PLC,368.59,360.06,"Plan future common use. Beautiful power side stock. Why sense image occur one pass program.
Chance involve treat. Near Democrat number young least. Film serious protect card board response.",1.5,235,False,92,2025-05-20
PROD_000142,Organized 6thgeneration workforce,Electronics,Freeman Inc,486.69,242.01,Mention run try relate itself space oil clearly. Song some relationship number threat method event. Order public reality man fight.,1.8,165,False,0,2023-03-31
PROD_000143,Polarized object-oriented hardware,Electronics,Villarreal Inc,136.6,298.21,"Free car chance control window. Particularly with around by sea professional.
Commercial unit weight development act treat. Yourself left simple.",1.5,524,True,18,2024-02-08
PROD_000144,Polarized well-modulated productivity,Electronics,"Watkins, Johnson and Cortez",174.67,461.61,Human under impact us create. Its describe election change want recent city. Discuss cause skill talk despite purpose control.,3.1,415,True,93,2024-11-11
PROD_000145,Expanded national focus group,Books,Ross-Miranda,947.77,112.21,"Growth main natural two. Let key or song politics.
Local inside probably music. History hard relationship film road reality benefit majority. Social less protect itself air deal certainly.",3.4,482,False,52,2023-01-31
PROD_000146,Extended attitude-oriented solution,Sports,Johnson-Martin,151.28,293.41,Hear ok purpose white something single race. Campaign activity job. If provide already position development fear individual. That stock officer mother.,4.1,638,False,87,2024-12-31
PROD_000147,Multi-tiered composite collaboration,Books,Nguyen PLC,923.12,300.28,"Traditional kid day quality increase. Page past true eye cut none fly season. Gun single present cup like message.
Approach scene before. Save war vote herself.",1.3,387,False,2,2022-10-20
PROD_000148,Robust 24/7 framework,Clothing,"Stone, Foster and Cordova",527.47,455.12,"Debate teach child finally under language.
Physical culture light group guy vote before. Some skin pattern age cup benefit. Fall visit religious product point nice.
Glass make east evening itself.",3.7,846,True,22,2024-01-22
PROD_000149,Innovative user-facing knowledge user,Home,Davis-Rice,902.58,301.91,Door knowledge early enough analysis standard meet. Democrat American citizen follow change and team population. Exactly soon weight close us fear.,4.5,544,True,0,2023-06-03
PROD_000150,Integrated intangible process improvement,Clothing,James-Smith,902.95,271.95,"Sort deep I kid least same old price. International control break full.
Staff if fine go small report represent. Point total and skin.",1.0,960,False,47,2024-09-23
PROD_000151,Assimilated composite parallelism,Electronics,Floyd-Olson,700.66,217.33,Black then all. Talk specific task behind. Begin hear area section pressure bed far.,4.8,493,False,94,2025-04-22
PROD_000152,Realigned transitional toolset,Sports,Smith-Hull,106.73,71.27,"Institution child opportunity debate cell several evidence good. Among the teacher space.
Want step long.
Many mission give choice large must home. Attention truth water consider.",2.9,238,True,69,2024-06-08
PROD_000153,Stand-alone zero-defect emulation,Home,"Mendez, Franklin and Walker",265.22,7.71,Foot on seat shoulder. Result career investment character boy expect production outside.,4.0,7,True,48,2022-10-19
PROD_000154,Grass-roots zero-defect benchmark,Clothing,"Wu, Mack and King",690.88,161.37,Theory reduce reality. Trade either source necessary door interesting for. Not good star activity quite.,2.4,158,False,32,2025-03-22
PROD_000155,Streamlined leadingedge Internet solution,Books,Stewart and Sons,856.42,214.66,Explain image hospital beat over generation and. Visit whose many modern picture but. Public heart million old add. Can southern whatever be serve hit.,2.5,282,False,52,2022-11-27
PROD_000156,Multi-lateral modular capacity,Sports,Miller and Sons,785.94,243.82,"Event which future game. Story a fly student study final. These laugh blue what argue significant.
Growth rule direction current because rest middle he.",2.5,568,False,39,2023-04-06
PROD_000157,Total secondary website,Sports,Campbell Inc,350.9,354.22,Mention enter trade teach race play then. Option name ready field series benefit boy. Challenge behavior man wait tend top military.,3.9,875,True,57,2023-04-12
PROD_000158,Monitored clear-thinking instruction set,Clothing,Saunders LLC,109.27,256.63,Wear century see yeah station chance financial. Campaign focus force attack. Wide quickly serious network former world edge.,4.1,820,True,81,2024-11-30
PROD_000159,Organized attitude-oriented success,Electronics,"Anderson, Garrett and Edwards",806.32,412.51,"Respond hope growth couple he. How believe pressure lose.
Either western detail player. Address hold everyone experience.",2.9,614,False,0,2025-03-25
PROD_000160,Down-sized regional Internet solution,Books,"Mcdonald, Davis and Brady",229.54,44.62,"Difficult feeling outside hair represent. Sport response phone safe model begin.
Idea way you speak capital hand opportunity. Parent design join truth middle make eye. Weight decision brother.",1.2,393,False,66,2025-01-24
PROD_000161,Progressive didactic website,Books,Peters-Collins,714.48,300.75,"Eight learn determine his teacher word government. About whom help. Class yeah system build.
Camera ok up teach me tend Mr. New energy key interview remain democratic deal.",4.8,839,True,56,2024-06-01
PROD_000162,Automated impactful initiative,Electronics,"Levy, Johnson and Nelson",209.68,330.16,Behind dark president enough your. Specific everyone there none both minute finally. Goal child end brother their see.,4.2,292,True,0,2023-03-16
PROD_000163,Compatible regional encryption,Sports,Berry-Gonzalez,515.43,350.73,Several improve travel hour office. Major leave mind live.,3.5,690,True,83,2024-12-24
PROD_000164,Customizable high-level algorithm,Electronics,Davis Inc,975.88,47.99,"Blood final whom film contain current will material. Serve end one actually.
Week best value since traditional economic least.",2.1,409,False,51,2022-12-14
PROD_000165,Multi-lateral multimedia website,Sports,Bradley-Gonzales,208.3,12.61,"Treat per light professor send. Gun radio peace church theory level.
Race final peace street. Put day space role sure above whom.",3.8,941,True,92,2023-07-31
PROD_000166,Distributed mobile infrastructure,Sports,Barrett-Dyer,915.85,177.31,Hour the enough friend know scientist his else. Plan win season give success speak draw table. Tell positive response can age.,4.9,283,True,24,2024-01-11
PROD_000167,Exclusive upward-trending monitoring,Home,Buckley-Carpenter,930.41,289.58,"Building imagine here wish modern recent everybody sit. Determine decade whose then beautiful ability they.
Specific religious stuff fire. Soon these imagine.",2.0,416,True,64,2024-10-13
PROD_000168,Secured methodical firmware,Books,Rogers and Sons,346.56,62.92,"Exist staff apply become condition majority and.
Radio others boy federal. Energy thing little plant dark cultural door. Interview enjoy Democrat.",3.1,263,False,48,2025-03-05
PROD_000169,Quality-focused systemic capability,Sports,Greene and Sons,488.78,125.42,"Television now camera man. Hair popular minute father public. Training eat in may across.
Majority at and. Suddenly guy though stand environment many. Month seven quite feeling most especially why.",2.4,794,False,75,2023-06-02
PROD_000170,Horizontal system-worthy service-desk,Electronics,Parrish LLC,487.14,132.62,Look method pass country. Never standard each production hope worry early. Into season for person. Way yes thousand nearly probably.,2.5,807,True,29,2024-04-19
PROD_000171,Multi-tiered dedicated definition,Books,Chung and Sons,418.29,179.78,"Sure human enter about each key. Bring good source success sound radio decade clear.
Term physical ground behavior. Above factor customer professor mother record.",3.1,717,False,11,2023-01-17
PROD_000172,Progressive value-added collaboration,Home,Guerra-Rivera,676.95,411.43,"Money bit teach movie magazine. Share that job ever capital. Test better gas that half level.
Situation product bad town option during view. Offer road system per. Energy maybe hold push full.",1.3,953,True,45,2025-03-25
PROD_000173,Open-source radical hierarchy,Clothing,Bowers-Guzman,895.36,138.19,Team meet back artist series care. Land simply feel should.,4.8,699,True,25,2024-06-30
PROD_000174,Operative maximized firmware,Clothing,"Bruce, Garcia and Simmons",738.06,437.01,"Game instead suddenly brother form only gas. Us since issue.
Safe again feeling site treat worry make quickly. Growth source walk stage way really.",1.8,207,True,45,2023-07-10
PROD_000175,Optional contextually-based capability,Clothing,Gay-Huber,781.14,64.34,Health wide price record team. Increase approach star partner serve feeling.,1.3,978,False,97,2023-09-10
PROD_000176,Progressive object-oriented model,Sports,"Payne, Lucas and Johnson",958.4,424.77,"Happy so necessary. Bad blue subject community class expect almost remain.
Wait item matter amount travel. Myself player million want yes.",2.5,322,False,73,2023-04-30
PROD_000177,Total background contingency,Books,Lopez-Cannon,495.89,492.28,"Lose chance staff film summer. Leg next short share seven. Star image kind size force behavior realize listen.
Participant collection hold knowledge because. Himself particular work notice reflect.",4.7,286,False,73,2024-10-22
PROD_000178,Reduced well-modulated access,Clothing,"Mcmillan, Trujillo and Adams",63.6,400.64,Hospital property space ask today product. Consider cause sit certainly professor practice window. Entire nice case tough. Life discover religious similar apply.,2.9,553,True,50,2024-11-27
PROD_000179,Persevering motivating info-mediaries,Clothing,"Rhodes, Brown and Gomez",462.61,64.58,"Trouble PM look interesting. Wait enough why trip close.
In effort its cover edge education.
Factor because rate issue.",3.1,323,True,0,2025-01-25
PROD_000180,Reactive foreground application,Clothing,"Miller, Baker and Lopez",385.62,54.87,"Remember may upon together. Report daughter take public reality answer.
Debate nature ability American. Past back statement amount hair camera bank.",2.4,882,False,33,2024-04-16
PROD_000181,Cross-platform bifurcated website,Clothing,Lewis-Berger,276.7,479.47,"And walk according low rule. But always baby other check threat. Board near lay fund.
Book your dream strong analysis early participant. Example son conference interesting goal task.",2.4,188,False,53,2025-02-11
PROD_000182,Synergistic disintermediate initiative,Books,"Snow, Burgess and Thomas",371.42,203.29,Account threat green security. Near among often five whatever significant. Bar mission support law.,2.8,585,True,87,2022-11-16
PROD_000183,Enhanced hybrid software,Clothing,Gutierrez-Rice,816.04,361.8,"Up former book agency result fight task present. Follow fight mean single. Anyone determine expect simple.
Wonder data draw firm remember. Record cover red apply officer music.",4.2,568,False,25,2022-06-18
PROD_000184,User-friendly encompassing intranet,Clothing,Rodriguez and Sons,802.03,370.58,College together strong difference defense treat standard seat. Last subject much herself. Law painting heart great.,2.9,9,True,17,2023-03-05
PROD_000185,Streamlined asynchronous matrix,Sports,"Lewis, Preston and Roberts",538.63,161.28,Mind require election. Amount go response picture up. Stock without free dark subject level.,2.9,256,True,88,2025-04-23
PROD_000186,Decentralized next generation Internet solution,Clothing,"Valencia, Smith and Wilson",69.43,407.84,Job about power operation such. Sport attack level. Their yes matter. Project month general such property real.,2.9,644,True,42,2023-08-08
PROD_000187,Re-contextualized systemic budgetary management,Books,"Roth, Hernandez and Gomez",367.34,282.37,"Happy drive until street value. Someone room site particular goal any ground.
Section these reveal indeed list guy building. Room majority market meeting. Material parent health world up.",4.7,263,False,0,2022-09-12
PROD_000188,Operative optimal orchestration,Electronics,Clark and Sons,357.57,341.39,"Phone early new news always.
Car something rich local discussion forget former. Ready apply our everybody nature make. Mean box next idea take operation face.",3.4,590,True,36,2023-12-01
PROD_000189,Polarized zero-defect open system,Books,Ellis and Sons,331.83,257.67,"Protect deep political deal. Me receive attention form goal.
Tonight least anyone even. Run could option. Late good individual think either current. Imagine help step leave.",4.1,457,True,36,2023-04-01
PROD_000190,Customer-focused analyzing toolset,Home,"Jones, Evans and Hodge",635.39,76.7,Employee cover everything once boy whatever blood. Son measure theory past particularly visit political. Where several television only hard. Decision fill me plant beyond foot.,1.7,827,False,78,2023-06-08
PROD_000191,Inverse executive instruction set,Sports,Smith and Sons,410.71,454.0,"Game economy hope remember college. Now about student bar know.
Everybody him artist weight person. Street else rate result anything anything.",1.3,351,True,83,2022-06-07
PROD_000192,Down-sized composite frame,Books,"Rodriguez, Morgan and Jones",713.32,304.67,Town front education. More west from business. Purpose itself growth sound cell.,2.6,908,False,46,2024-04-02
PROD_000193,Profit-focused bifurcated frame,Sports,Mitchell Inc,525.72,227.89,"Which really however officer couple building take. Focus accept building class report blue.
Charge people media. Reduce job woman message minute.",1.7,874,True,30,2024-10-26
PROD_000194,Up-sized bifurcated open architecture,Books,"Johnson, Davis and Lee",941.02,351.84,Third design grow stock move color. Face myself value win road. Thing theory TV house.,1.3,170,False,8,2024-05-31
PROD_000195,Reverse-engineered web-enabled monitoring,Home,Bowman-Browning,552.94,18.05,"Travel few will red time material. Avoid large full soldier. After strategy recognize.
Affect pull sound our. Whom certain sometimes source case everybody it. Those join specific writer or.",2.6,783,True,79,2025-03-19
PROD_000196,Re-engineered content-based implementation,Clothing,"Lee, Lambert and Jackson",93.46,466.14,Prepare might long worker truth ever practice. Good trial significant discuss minute. Happen dog star rise race or purpose practice.,2.6,234,True,56,2024-10-11
PROD_000197,Persevering homogeneous middleware,Clothing,Bush-Perry,139.95,420.07,National activity foot often authority. Need science everyone commercial too.,1.1,679,False,41,2024-08-19
PROD_000198,Advanced full-range superstructure,Home,King Group,472.51,436.09,"Third town cell end information reduce successful. Than when year cup what question describe.
Cause bag as society. Staff president now discover war film kitchen. Theory west build total kid first.",4.7,561,False,89,2023-09-07
