product_id,name,category,brand,price,cost,description,rating,review_count,in_stock,stock_quantity,launch_date
PROD_000396,Organic secondary workforce,Books,Bell Inc,135.93,347.64,Watch rock piece development difference practice maintain man. Response industry reduce guess who part. Rather pick discover source measure fact. Call series raise often win top.,1.2,139,True,58,2022-08-04
PROD_000397,Ergonomic 4thgeneration orchestration,Home,"Brown, David and Fowler",179.48,175.07,"Use ever note imagine focus. Article you mission kitchen pick serious TV.
Certain top end region less certain song. Seat drop pay experience feeling owner cut.",4.5,618,True,81,2023-01-18
PROD_000398,Customer-focused contextually-based Graphical User Interface,Sports,"Davis, Santiago and Tapia",906.51,291.17,"Hotel I entire eight bit kind term. End would interesting resource sure. Field suddenly husband sometimes.
Or at have leave easy reach. Pick father employee lawyer.",3.2,235,True,66,2022-10-24
PROD_000399,Function-based high-level capacity,Home,Mckenzie-Lara,863.57,112.14,Budget their professional they southern finally maintain. Find blood energy billion she pretty. Pressure fall simply.,2.9,473,False,0,2023-11-09
PROD_000400,Devolved leadingedge matrix,Home,"Garcia, Morris and Holland",738.81,127.09,"Still own strategy benefit late. Maintain travel education treatment ability. Agreement soon there Mrs safe.
Play television end best pay home new. Allow reason each inside focus.",2.3,593,True,75,2024-02-01
PROD_000401,Advanced 24hour standardization,Clothing,Smith LLC,914.61,449.63,Mrs national however model look civil right. Choice training your act audience world my tonight.,2.7,45,True,93,2024-12-04
PROD_000402,Team-oriented radical function,Sports,Bates Group,43.27,267.91,"Mrs system fill cold think customer. Side PM music population especially food participant apply.
Vote growth support mean lay. Throughout power energy pressure.",2.9,817,True,30,2023-04-29
PROD_000403,Optimized maximized open system,Electronics,Burton-Moore,562.89,11.15,"Less sit meet radio.
Foreign enjoy must special none. When list class evidence situation feeling school establish.
Success office company. Need sister wife get.",3.9,972,True,37,2024-05-27
PROD_000404,Inverse local Graphic Interface,Clothing,"Thomas, Velez and Anderson",651.15,49.91,"Their instead agency reach environmental stand. Ability fund president. Campaign decision tax event.
Per wonder experience low also. Win general occur always.",2.9,312,True,73,2023-01-26
PROD_000405,Organic clear-thinking secured line,Sports,"Morrison, Duffy and Davis",34.16,230.15,"Respond stop economic. Film show ball add enough simple animal.
Crime firm test live. Lead Democrat since item new present.",4.1,895,False,47,2025-05-02
PROD_000406,Polarized multi-tasking concept,Home,"Morales, Golden and Dixon",706.85,5.68,And approach gas end political. Summer draw know meeting carry enter.,3.5,394,False,37,2024-01-02
PROD_000407,Customer-focused static core,Home,Wilkerson Ltd,755.35,350.54,"Baby property least which left. Ball accept blue really.
Family stand here stop nation will tend. Forward choice between election range of even. Your day player simply hospital.",3.5,589,True,10,2025-01-04
PROD_000408,Ergonomic stable architecture,Sports,Haney Inc,882.03,369.2,Recent majority artist trade yet mother. Unit perform Mrs why kind. Fly north style policy indeed bed alone.,1.2,968,False,14,2025-03-08
PROD_000409,Visionary human-resource conglomeration,Home,"Marshall, Wise and Cook",371.92,311.47,"By start cut many area day let plant. Can season and.
Sit table hold. Event debate quite able power. Wife decade right huge available idea.",2.5,179,True,99,2023-11-09
PROD_000410,Streamlined dedicated secured line,Clothing,Leblanc-Diaz,147.01,170.79,"Movie college anything third center. Free pretty child collection along.
Sort to animal if baby break. Party above half most page. Hair play cultural appear man sell industry.",3.2,664,False,96,2024-02-14
PROD_000411,Organic exuding moderator,Sports,Riley-Williams,872.41,352.91,Major where stay subject traditional about. Wind wide image home official eye fight lay. Ago lawyer fire four quickly hot.,4.0,779,True,34,2024-11-28
PROD_000412,Re-contextualized methodical attitude,Sports,"Abbott, Reyes and Allen",683.41,142.19,Seven someone before feeling. Street wish child huge. Staff describe network quickly. Especially respond capital explain.,1.3,353,False,67,2024-05-29
PROD_000413,Diverse empowering protocol,Electronics,Cook Ltd,475.45,268.29,Note research do discover class follow herself. Young contain exactly say mind impact major. Experience tonight Mr whom team than. Oil guy heavy toward about country politics.,4.3,921,False,47,2023-06-08
PROD_000414,Phased uniform complexity,Electronics,Jones-Reese,196.46,442.57,"Cost certainly fly our nation likely. Ten crime risk consumer feeling watch choose.
Coach civil control civil morning development. Result bar matter until computer clear full.",1.3,400,True,9,2024-12-26
PROD_000415,Up-sized systemic attitude,Electronics,Evans-Jackson,173.11,60.45,Control would edge hard. Push mission station note offer dinner. Alone increase choose whole reality cultural.,1.6,154,True,80,2024-02-12
PROD_000416,Multi-lateral object-oriented hardware,Electronics,Hicks and Sons,300.23,484.94,"Can consider recently course accept above instead. Newspaper owner field stay. Race expect rest send collection people.
Economic happen position thank among point herself. Professor cause such ten.",3.2,135,False,56,2024-05-03
PROD_000417,Triple-buffered empowering product,Electronics,Flynn Ltd,298.59,36.16,Great improve president without central process. Inside population ago positive now enter any.,4.5,237,False,43,2022-08-10
PROD_000418,Synchronized zero administration database,Books,Jones-Hernandez,491.28,334.6,"Some amount assume put very. Easy travel people throw half risk way.
Yard clear teacher I. Know just less itself practice property fact clear.",3.1,561,False,72,2022-09-29
PROD_000419,User-centric multimedia matrices,Clothing,Moran-Delgado,899.29,156.72,"Eight attorney area why rich.
Recognize reach rule south. Common air nothing debate require increase argue. Beat available learn provide ever.",4.2,232,False,36,2023-10-07
PROD_000420,Multi-channeled secondary budgetary management,Electronics,Wilson-Boyd,156.84,145.77,"Forward again go entire. Use listen rate assume. Music boy who business bad.
Ten likely benefit debate. Pattern enjoy along bit tax white. Place west their.",4.8,633,True,36,2025-05-25
PROD_000421,Inverse uniform synergy,Clothing,Turner Inc,973.46,420.47,Join social science investment or fish war. Imagine between address us save. Offer site strategy opportunity better significant study significant.,3.8,682,True,14,2022-11-02
PROD_000422,Total secondary contingency,Electronics,"Meyer, Mathews and Torres",993.83,289.39,Report tell either change green player. Remain start chance interview population.,2.8,378,True,90,2023-11-04
PROD_000423,Secured multi-state emulation,Electronics,"Cruz, Ellis and Jones",668.89,489.12,"Member three edge. Me society plan. Respond technology despite score.
Lawyer condition no public social history. Poor administration land window character speech.",1.6,459,True,15,2024-06-12
PROD_000424,Polarized hybrid matrices,Electronics,Todd Inc,410.51,252.21,"Direction sound despite on possible get. Hospital identify young into society future. Moment ago already.
Apply design indicate perform guess reality opportunity measure.",1.6,469,False,94,2024-02-26
PROD_000425,Horizontal zero-defect architecture,Sports,Green Group,975.84,168.98,Answer actually conference player weight particular. Key begin brother.,3.8,485,False,96,2023-06-13
PROD_000426,Exclusive user-facing benchmark,Sports,Cardenas-Gomez,670.21,400.79,"Per appear Mrs statement. Along cup on defense many new.
Think line happen data some wall. Eat product wonder management dark value. Ability bit arm nation several resource debate.",3.9,944,False,14,2024-02-29
PROD_000427,Monitored mobile strategy,Home,"Nichols, Robles and Wilson",901.16,74.01,Base adult they end entire out. Development operation seat relationship thought. Its positive by college.,3.2,315,True,28,2024-07-21
PROD_000428,Reverse-engineered foreground info-mediaries,Home,"Hunter, Morales and Wright",363.81,166.55,Today sure protect last ever couple paper. Mother computer must news. Base police field difference respond different. Tough help popular already wide artist.,3.4,199,True,98,2022-08-22
PROD_000429,Diverse bifurcated system engine,Books,Vasquez-Moss,203.75,46.38,Important become her throughout them media perform maybe. Relationship can hard instead. Capital office news form reflect trouble physical.,4.4,693,True,50,2022-10-16
PROD_000430,Function-based explicit portal,Clothing,"Myers, Williams and Jacobs",495.55,303.57,Write consumer new throughout tend general. Against admit throughout something bit. Somebody relationship receive.,3.0,57,False,91,2023-05-06
PROD_000431,Pre-emptive web-enabled strategy,Home,Thomas-Bell,375.92,189.55,Develop such animal customer green. Practice sort kitchen into. Test free alone fly will five somebody.,2.1,359,False,71,2024-07-12
PROD_000432,Streamlined disintermediate instruction set,Electronics,Gardner-Jones,223.53,444.46,"Receive race season listen. Several attention that hospital. Manage effort beat help.
Article rock choice include.",4.0,425,False,93,2023-06-19
PROD_000433,Ergonomic local flexibility,Home,"Humphrey, Chan and Schmidt",731.31,210.03,"Stand something population it game now. Long home lawyer seven game stay.
Single once why series wife.",4.3,612,True,38,2024-04-05
PROD_000434,Visionary tertiary access,Home,Duffy Ltd,988.49,265.02,Significant them clearly land evening drive. Former reveal term mind artist then show. Do prepare possible entire agency statement people.,2.3,955,False,0,2024-07-16
PROD_000435,Self-enabling regional structure,Home,"Fields, Williams and Joseph",642.41,140.3,Thousand subject visit company close. Source billion go near cover site. Be threat but third church scientist deep.,1.7,473,True,48,2024-06-15
PROD_000436,Object-based regional success,Books,"Mills, Ray and Oconnor",558.32,25.91,Common say maybe conference less wind. Consider election if window up interest amount reach. Hotel kitchen point million.,4.3,854,False,94,2022-10-25
PROD_000437,Horizontal mission-critical system engine,Home,Maynard LLC,232.27,396.65,"Yeah tax we newspaper step four know. Whose late ago lay president window paper step. Decide soldier hospital tell.
Network cover threat claim follow. Talk which each. Spring because beyond front.",1.6,307,False,85,2024-01-12
PROD_000438,Up-sized clear-thinking hub,Books,"Gonzalez, Williams and Nolan",422.98,248.48,"Fill home trial cover how likely. Middle sound win join its information system.
Rest today meet bring product. Seem six teacher seven north.
Star six ever test oil chair.",3.8,250,True,35,2023-12-12
PROD_000439,Reverse-engineered web-enabled policy,Home,Garcia Inc,994.38,38.03,"Glass fear worker bad next sell rich with. Alone down financial whom air ten force. Thank minute bad red customer.
Truth indicate trouble management cultural. Save blue travel general.",4.0,595,False,33,2022-10-26
PROD_000440,Multi-layered object-oriented framework,Home,"Walters, Hartman and Johnson",974.51,410.05,"Three would inside. Add series future word product wrong indicate. His decision federal place work pretty thus manage.
Able on almost bring. Friend sound worker social grow.",2.5,750,True,20,2023-03-24
PROD_000441,Grass-roots neutral standardization,Sports,Morris-Jarvis,67.92,163.24,"Now decision response all four share. Series public site between treatment not hard.
Phone doctor popular often. Sport hundred key ago test worker. Authority medical strategy put.",4.5,138,False,34,2023-11-05
PROD_000442,Versatile attitude-oriented collaboration,Books,Richardson PLC,425.31,456.49,Note reach mind day article edge. Water back country window reveal give president. Add arm author big report.,2.4,296,False,9,2022-12-05
PROD_000443,Inverse dynamic standardization,Sports,"Cruz, Morris and Ward",201.87,315.87,Especially view production respond realize. My article treat around course can four.,4.1,613,True,40,2024-07-08
PROD_000444,Decentralized intangible knowledgebase,Books,"Petersen, Rogers and Wood",278.73,350.49,Town cost nature positive worker court measure. Fall film hotel college. Against main production poor finish current purpose.,2.5,547,False,1,2022-08-01
PROD_000445,Multi-layered optimal artificial intelligence,Clothing,Figueroa-Stein,522.98,189.64,"Security see base fund before find ground. Cold interest east fish case low. Necessary center since look.
Movement production against choice away upon writer. Fire blood possible rest certainly fine.",2.9,348,True,19,2022-12-26
PROD_000446,Horizontal dynamic Local Area Network,Sports,"Mendoza, Gregory and Rhodes",228.89,98.27,"Professional pay school through whole age. Into scientist nor human. Partner save million last contain idea option.
As girl take real. Peace herself collection language idea.",4.6,628,True,9,2022-10-25
PROD_000447,Cross-platform asymmetric circuit,Electronics,Olsen-Dudley,820.65,462.09,"Campaign record use right. Power travel decision necessary space.
Born time wear issue image. They likely question treat including main maintain born.",2.9,319,False,56,2024-12-14
PROD_000448,Mandatory multimedia monitoring,Sports,"Baird, Dawson and Yang",527.88,485.21,"Attorney example positive market ten mind age. Phone attack window suddenly more place everything.
Safe stay similar own. Everybody visit kid stay.",1.7,311,True,15,2024-08-26
PROD_000449,Multi-layered tangible capacity,Clothing,Kemp-Holt,137.42,348.65,"Political stop tough bit. Many talk building degree friend physical.
Product others PM air least situation. Live kind area final. Front decision yard author cultural simply.",3.8,314,True,10,2023-03-17
PROD_000450,Multi-lateral high-level Graphical User Interface,Home,"Herman, Martin and York",693.9,393.09,"Light play great fly type idea tree. Democratic film measure career child.
Anything authority industry toward. Among class future research west then.",1.3,793,False,5,2022-10-13
PROD_000451,Re-engineered global info-mediaries,Clothing,"Franco, Howell and Mccormick",116.73,397.56,"Run institution girl however nothing travel. Pull should from must.
Prove call however oil enough. Town agree almost thousand.
Mrs heart identify. Father way in.",3.1,60,False,32,2024-01-01
PROD_000452,Multi-channeled discrete artificial intelligence,Electronics,Shelton-Lewis,75.57,335.46,"Allow step top describe. Use leader coach.
Effect use our forward media court hundred. Clearly road almost main hot. Property morning western town several middle brother.",4.0,801,True,26,2024-01-02
PROD_000453,Assimilated hybrid projection,Sports,Soto LLC,902.15,96.47,"Race human economy alone such unit require. Bit rich hand piece candidate one.
Number argue building this prove back history stop. Find protect authority.",2.4,92,True,35,2025-03-16
PROD_000454,Automated full-range access,Sports,Morris and Sons,354.35,84.48,"Stage woman ever property sign word speak. Family service three.
One all identify sell. Compare control identify painting set.
Meet box girl represent race condition whose. If fact cause certainly.",3.0,746,True,8,2023-02-19
PROD_000455,Switchable executive application,Electronics,"Harris, Cervantes and Lee",821.38,382.81,"Hot player goal play consumer. Increase image popular age war loss. Indicate draw agent cost central your.
Cut important sport exactly them peace night dog.",3.1,732,True,21,2024-02-22
PROD_000456,Fundamental cohesive methodology,Sports,Figueroa-Martinez,14.28,364.05,Vote room the member center. Ahead likely sometimes middle site.,4.7,942,False,75,2023-02-16
PROD_000457,Devolved system-worthy strategy,Clothing,"Mccarthy, White and Huang",445.26,479.09,"You draw floor since hot tend. Since control usually kind gun.
Full reduce sit attention above human. Street situation these different ok.",1.7,363,False,65,2023-10-17
PROD_000458,Ergonomic user-facing orchestration,Clothing,Aguilar Inc,413.49,381.9,"Wind form half approach improve. Item reason tax future town. Wide leader scene inside.
Per voice oil walk others your. One image scientist case her work. Remember society girl bit eye late above.",2.3,477,True,63,2024-07-22
PROD_000459,Future-proofed client-server contingency,Books,Garcia and Sons,707.67,280.78,Whose blue respond opportunity. Court message property them radio agreement discussion.,1.2,335,False,36,2025-05-21
PROD_000460,Triple-buffered explicit definition,Home,Horton Inc,604.38,159.44,Whom throw herself upon crime give land be. The tend deep view plant war. Food blue song name. Ready chair huge much.,4.9,454,True,37,2023-05-04
PROD_000461,Fully-configurable upward-trending instruction set,Home,Garcia-Robinson,196.89,39.46,Book development letter fact history issue. Step five drop laugh after sell. Him back marriage employee about.,4.4,487,False,86,2023-10-15
PROD_000462,User-friendly system-worthy open architecture,Home,Vaughn-Henry,675.36,201.2,"Thousand third parent. Point general theory laugh.
Son employee study its far doctor. Any owner letter suddenly live. Generation industry open arm family.",3.1,692,True,50,2023-12-14
PROD_000463,Programmable contextually-based core,Home,Shepard and Sons,698.08,488.9,Yard main democratic statement final value movie raise. Pay blue paper think letter easy. Memory hot song offer center Republican. Dinner realize cultural if me.,4.0,913,True,0,2023-03-29
PROD_000464,Multi-layered actuating interface,Clothing,"Carroll, Gilbert and Shaw",345.24,299.51,"Enough including site article off left character four. Everybody land daughter strategy pattern treatment be today.
City author education reveal without. Often leg hope.",5.0,125,True,92,2024-07-04
PROD_000465,Sharable system-worthy Local Area Network,Home,Harris LLC,285.72,358.18,"Herself spend sport anyone laugh who. Now part fly project a agreement. Short whom better surface age college.
Week impact guy among brother. Material message nor cause.",3.3,279,False,85,2022-10-23
PROD_000466,Polarized motivating core,Sports,"Williamson, King and Choi",950.63,493.82,Lose show finish up executive carry. Discussion decision want since surface newspaper. This term garden number among.,3.0,150,False,32,2024-08-30
PROD_000467,Fully-configurable explicit capability,Home,Vega-Stevenson,502.29,316.04,Data responsibility prepare very remember. Whatever region trouble. Book rest charge wish personal most begin. Provide this professor notice which attack.,1.5,101,True,63,2024-10-23
PROD_000468,Organized real-time functionalities,Electronics,Patton Group,972.34,194.4,"Process tough paper race give. Really model eat woman reduce class southern.
Maybe energy performance arm audience. Performance end act and poor pressure.",3.7,156,False,12,2024-07-17
PROD_000469,Front-line next generation hierarchy,Electronics,"Reed, Rivera and White",664.46,262.37,"Quite born play. Question few final support man center.
Arm bit road reality talk. Add country care bill prepare lead past. Care since security.",3.0,477,True,63,2025-01-31
PROD_000470,Customizable coherent Internet solution,Home,Ford Ltd,509.74,273.51,Several international until pretty deep reduce someone. Give level investment structure.,4.2,553,True,4,2023-10-01
PROD_000471,Exclusive web-enabled knowledge user,Home,"Meadows, Werner and Thompson",881.31,63.97,Show government into find marriage. On together follow market reveal focus. Imagine half story how out similar including.,2.8,873,False,4,2023-12-06
PROD_000472,Multi-channeled 6thgeneration superstructure,Electronics,"Williams, Frank and Barker",185.09,331.41,"Realize physical detail. Mean all fast individual. Form teacher picture clear police citizen free.
She spend night company. Enter star without these care.",4.1,905,True,17,2025-01-08
PROD_000473,Implemented object-oriented portal,Books,"Huff, Fleming and Bridges",718.56,246.29,"Opportunity development give seven positive Republican. Card resource present focus.
Number analysis nature. Property senior leader she business expert parent.",1.4,691,False,87,2024-09-07
PROD_000474,Robust web-enabled info-mediaries,Sports,"Atkinson, Montgomery and Chavez",576.48,240.58,"Agreement relate pay happen. Debate treat yeah group save collection admit.
Admit meeting family bed. Cost phone we fly now strategy natural.",4.4,518,True,63,2024-10-13
PROD_000475,Multi-tiered stable algorithm,Sports,"Morales, Odonnell and Coleman",971.15,310.39,"Deep half beyond stage. Small news here over within.
Stop Mrs civil leg article important people capital. Indeed stuff book hear. Pull through our itself again model concern.",2.4,291,False,0,2024-02-13
PROD_000476,Sharable stable interface,Sports,Harris LLC,54.66,419.28,"Reason environmental realize drug music list religious. That both middle picture production talk race. Result do list for.
Dark entire coach bank toward. Protect there seven.",2.4,759,True,80,2025-04-10
PROD_000477,Enhanced user-facing application,Books,"Hurley, White and Brown",386.76,216.93,"Family sport dream fish page method theory. Better thing only live sort alone fact.
Yard option address site place memory. Card share material religious.",5.0,421,False,0,2022-10-11
PROD_000478,Open-source motivating complexity,Clothing,Williams Ltd,255.13,325.8,Party until main industry. Yourself identify ball history later plant. Clearly method war statement environmental lead.,3.4,932,True,14,2025-03-10
PROD_000479,Reduced fresh-thinking algorithm,Books,"Anderson, Elliott and Wilkinson",178.07,271.52,Meet one order green protect. Everyone order cell far successful probably shake eye. Skin fill by blue student.,1.1,673,False,53,2025-02-03
PROD_000480,Versatile multimedia monitoring,Books,"Robles, Evans and Stewart",30.19,237.5,"Particular time economic wonder little newspaper choice.
Better since reflect pay material end despite Democrat. Low yourself security you scene your edge.",1.1,324,False,41,2023-04-04
PROD_000481,Cross-platform contextually-based forecast,Sports,Taylor-Hall,106.74,246.74,Analysis father attention low. Statement any push task door. Other under news phone total.,3.8,210,False,97,2023-07-17
PROD_000482,Cross-platform upward-trending approach,Books,"Mills, Hubbard and Elliott",174.95,153.26,Wind property month treatment sometimes own establish. Build stand represent dog care politics in. Customer truth seat throw five. Specific crime exist quality Republican.,4.9,206,False,100,2024-06-04
PROD_000483,Virtual composite function,Electronics,Castillo-Allen,841.97,270.24,"Type budget career. Hand people music onto. World anyone field born writer structure probably likely.
Fact perhaps computer also himself. Pick baby century town decision bed similar less.",2.1,48,False,51,2022-09-15
PROD_000484,Automated 3rdgeneration data-warehouse,Clothing,Dalton-Christensen,628.32,479.18,Team dream single worry year door establish. Will stage before really especially travel me. Dinner answer computer community source movie.,3.9,592,True,34,2023-10-02
PROD_000485,Multi-lateral 5thgeneration info-mediaries,Electronics,Nunez-Hawkins,570.75,267.88,Civil you office for support soon. West sense public management development baby.,2.7,355,True,38,2023-08-08
PROD_000486,Proactive exuding project,Sports,Chapman-Ramirez,806.08,219.29,"Vote series family series realize growth. End would hand page mother heart. Lot pay wall pretty huge.
Sure sound performance tree develop. Into but herself gas.",3.2,204,False,79,2024-12-11
PROD_000487,Assimilated multi-tasking website,Sports,"Allen, Rose and Goodman",458.69,382.9,Population wear interview fly plant large she. Off sign represent employee glass factor class. Possible around shoulder field his cold local idea.,1.7,19,True,27,2023-06-07
PROD_000488,Adaptive needs-based initiative,Home,Boyd-Strickland,275.25,320.77,Health blue west own develop. Sound include audience research. Pay child from describe tonight after across. Rock performance society than.,4.2,873,False,93,2024-10-20
PROD_000489,Customer-focused regional matrices,Electronics,Mckinney Ltd,527.04,185.32,"Price deep manage most. Hold sit develop.
Entire audience before back couple almost eat religious. People big enough. Opportunity necessary live recently live wife black.",1.6,154,False,52,2022-08-24
PROD_000490,Advanced homogeneous attitude,Books,Rose LLC,861.57,456.01,American matter stop beyond try seek car. College how stock them.,3.5,866,False,36,2024-10-05
PROD_000491,Optimized discrete conglomeration,Clothing,"Hernandez, Hernandez and Rodriguez",263.87,302.61,Significant treatment true view medical. Business land board together machine test. Spend education feeling sport.,2.6,116,True,31,2024-05-20
PROD_000492,Devolved intangible data-warehouse,Books,Hanna and Sons,469.51,282.11,"Process picture explain kind. Such which child choice.
Real past point add. Sing indeed interesting rule. Evidence million cold member majority action treatment.",2.7,662,True,34,2024-10-22
PROD_000493,Proactive bottom-line instruction set,Clothing,Underwood-Larson,38.84,395.89,"Point support run training general left. Early spring plan born.
Cold maybe old player company. Show certainly situation community life help whether.",2.1,563,True,5,2022-07-07
PROD_000494,Stand-alone bandwidth-monitored framework,Home,Cruz LLC,784.4,32.39,Grow trip never network work. Carry eat smile four each. Hold method class car seven out.,4.6,321,False,52,2025-03-04
PROD_000495,Cross-group bifurcated artificial intelligence,Books,Goodman-Rice,674.95,443.43,"Deep government participant civil. Both nation themselves try. Although simply heavy together large point.
Thought star painting size case the.",2.6,859,True,73,2024-09-06
