product_id,name,category,brand,price,cost,description,rating,review_count,in_stock,stock_quantity,launch_date
PROD_000199,Reactive holistic structure,Sports,Byrd Inc,185.26,300.8,May fight relationship agency. Language care energy institution.,3.5,651,False,81,2024-11-05
PROD_000200,Implemented hybrid ability,Sports,Smith LLC,316.55,176.85,"Business from free seat number. Another line wish chair.
Others ground sense yet less. Major some baby mission.",3.2,824,True,46,2022-10-13
PROD_000201,Function-based foreground Graphical User Interface,Home,"Mason, Noble and Stokes",267.2,155.27,Stock development box new rate material window. Single road always phone somebody girl.,1.0,834,True,60,2023-05-17
PROD_000202,Operative logistical access,Sports,Rowland Ltd,18.22,461.43,"Should culture next evidence. Rather get radio give. Sense purpose environment view support late.
Quality lay recognize me moment will onto theory. Window sometimes several all. Lay cause program.",4.8,488,False,0,2023-10-06
PROD_000203,Synchronized mobile monitoring,Home,"Smith, Acevedo and Davis",799.98,300.52,"Necessary impact bank industry week.
Call factor statement which arrive else. Increase bank source woman maybe letter add.
For since realize process. Skill ahead each final heavy.",4.2,561,False,71,2022-11-30
PROD_000204,Persistent 3rdgeneration forecast,Home,"Martinez, Hickman and Frazier",400.79,85.82,"Memory should eye career. Sport two ready spring.
Skin coach happen ball stage arm early. Tough least cup successful government.",3.9,399,False,10,2022-07-07
PROD_000205,Advanced mobile benchmark,Home,Mclaughlin Ltd,629.06,260.72,Apply almost that computer within. Enter position interest until pressure. Security half customer enter carry. Build strategy board rate property perform.,4.2,627,False,95,2024-03-18
PROD_000206,Monitored multimedia approach,Sports,"Clark, Caldwell and Fitzpatrick",810.71,209.39,Meet air agreement south. Animal market program because rather through. Space guess small state treatment group exactly.,4.4,186,True,81,2024-11-02
PROD_000207,Proactive maximized parallelism,Home,Glover PLC,621.54,139.71,President here old cause against. Agency church guess special government. Owner analysis sense art street.,3.5,192,False,0,2024-03-22
PROD_000208,Progressive empowering flexibility,Electronics,Stevens PLC,970.01,15.95,"Rate drug before surface. Travel now rise from sometimes page security great. Government lead medical break large cover body report.
Keep blood direction sure. Total claim outside decade television.",4.9,288,False,56,2023-07-26
PROD_000209,Profit-focused attitude-oriented capability,Electronics,Bell and Sons,240.47,79.59,"Responsibility class live practice quickly full ground. With water kind use information loss evening.
Decision recognize describe sell star yes lead rule. Resource mind democratic industry.",3.0,350,False,63,2024-02-10
PROD_000210,Cloned next generation knowledgebase,Books,Johnson PLC,469.04,396.76,"Live decide do. Sure toward black candidate live cover water. Score military appear without.
Prove young paper stop recent moment include. A arrive character.",2.3,863,True,0,2023-04-09
PROD_000211,Enterprise-wide dynamic policy,Home,"Lyons, Hudson and Barton",80.66,237.72,"Decide spend specific trade throw. Return watch boy guess smile ahead cold.
Moment arm its able painting voice let.
Western safe business determine.
Kitchen personal institution.",1.8,861,False,1,2022-10-25
PROD_000212,Enhanced motivating interface,Electronics,Garcia-Pruitt,974.84,358.77,"Always soldier try prepare. She food animal west else.
Black theory end cover. Painting cut off expert international. Last why kid thus nice theory.",2.5,998,False,4,2024-04-06
PROD_000213,Intuitive didactic knowledgebase,Clothing,Williams-Rasmussen,466.22,386.64,"Defense such issue entire put our your. Word worry just address key.
Lot operation home. Soon study health skill.
Tonight total cause anyone wife since. Property we city well white.",3.1,213,False,39,2023-06-15
PROD_000214,Networked homogeneous adapter,Books,Carpenter Ltd,167.02,365.48,"True specific defense president animal west.
Top environmental start wish start.
Pressure by middle its view environment. Your kitchen result kid whole say soon international. Material voice between.",4.0,562,True,81,2023-04-13
PROD_000215,Networked next generation intranet,Books,Keller Ltd,206.73,444.32,Mean reflect job themselves trade. Remain son strategy school effort hear maybe. Business chance set right film ever.,4.5,223,True,55,2022-11-28
PROD_000216,Intuitive non-volatile toolset,Books,Smith Ltd,24.91,398.22,"Technology catch receive face event. Else sister information type lot guy still.
Safe let receive hospital. Firm nature study officer throughout.",3.3,405,True,0,2022-11-07
PROD_000217,Optional fault-tolerant groupware,Electronics,House-Jones,585.26,346.92,Explain perhaps mind more. Next maintain century guess science center above baby. Gun American three color step level quickly.,3.8,158,False,31,2023-02-27
PROD_000218,Ameliorated attitude-oriented benchmark,Clothing,Owen PLC,504.91,344.54,"Hundred edge mother. Mission floor card face child hotel.
Everybody include leader education. Religious model fish visit whatever they current. Lead understand prevent foreign why western trial.",2.4,992,True,0,2025-05-30
PROD_000219,Vision-oriented user-facing Internet solution,Clothing,Baker Group,704.3,396.78,Plant inside we option hotel. Exist it team student magazine operation course. North stuff though any spend about pressure. Spend parent around skill per task scientist.,1.5,238,False,100,2022-08-28
PROD_000220,Balanced scalable focus group,Books,Simon-Reyes,807.46,222.17,"Indicate consumer along hospital interesting. Place dog deep question already.
Country capital campaign drive Mrs. Address approach manager finish talk.",1.8,705,False,17,2023-10-30
PROD_000221,Devolved empowering flexibility,Books,Turner and Sons,899.67,245.22,Trade activity machine. Community question reflect drop up series major.,2.8,301,False,23,2022-12-20
PROD_000222,Triple-buffered actuating challenge,Sports,Reed Ltd,354.18,367.54,"Those store development economic anything. Line take much party.
Congress explain land country relate strategy attorney. Owner page analysis last. Read body worry get.",2.1,851,True,0,2025-03-18
PROD_000223,Object-based solution-oriented success,Clothing,"Nguyen, Davis and Smith",454.88,410.61,"Couple economy democratic environment economy. See nor some open.
Choose set type account. Leg change turn whatever.",3.2,464,True,64,2023-09-13
PROD_000224,Sharable client-driven Graphical User Interface,Home,"Simon, Coleman and Bernard",736.31,442.05,Exist hard including look need finally. Pressure drop ever inside describe contain expert. Government smile set including tell expect.,3.5,372,True,8,2025-05-29
PROD_000225,Object-based non-volatile service-desk,Sports,Howard-Montoya,820.85,98.99,Impact smile actually size policy shoulder up relate. Season check notice house evening eight cause. Nor contain thought.,3.7,784,True,41,2024-04-15
PROD_000226,Phased 6thgeneration moratorium,Home,Walker Group,644.48,59.68,"Opportunity central administration single. Point chance throughout provide paper coach.
Beautiful writer project. Nothing today news agent source. Special cup approach nation Mrs defense your family.",3.1,68,True,16,2023-12-26
PROD_000227,Profit-focused cohesive software,Clothing,"Kelly, Daniel and Moreno",874.75,105.03,Congress skin interview number society help not sure. Southern sing force same city. Place fight still include music.,2.9,101,True,49,2023-08-04
PROD_000228,User-centric value-added model,Home,"Boyd, Ruiz and Whitney",530.55,352.15,Will page world threat senior. Growth minute interview religious indicate beautiful project event.,2.0,375,True,9,2024-01-31
PROD_000229,Adaptive background time-frame,Electronics,"Mcdowell, Moore and Marsh",930.9,108.33,"Democrat may happen all phone drive. Hair democratic up drug.
Quickly fact above network bag. Animal each near trip low alone both. Girl adult summer each production lead player human.",3.0,911,True,81,2023-02-01
PROD_000230,Profound zero-defect matrices,Electronics,Watson Inc,367.31,373.02,"Responsibility fight peace box with. Today ready laugh card. Mouth control almost effort.
Down yard rest act thank value dark phone.",4.6,841,False,7,2023-06-25
PROD_000231,Universal local info-mediaries,Sports,Ward Ltd,273.15,25.12,"Because born job nor.
More town Democrat three. Quickly big serious husband measure both item.",1.3,311,True,66,2022-06-20
PROD_000232,Exclusive asynchronous portal,Electronics,"Campbell, Jones and Ortega",110.2,119.35,"Follow floor month maybe clearly fact upon.
Discussion market economy later. Anyone according pretty dinner agency last evening. Store fund member focus responsibility.
Marriage clear cold political.",2.5,197,True,22,2022-07-09
PROD_000233,Innovative 6thgeneration initiative,Sports,Brown-Craig,751.69,210.52,"Soon rest leave property even goal speech. Note treatment news weight piece become.
Language produce agent play. Range vote my price build artist buy.",1.4,653,False,89,2022-09-18
PROD_000234,Optimized fault-tolerant groupware,Home,Frederick Group,883.99,87.57,"Can check day. Edge world whatever. Laugh them key price follow.
Arrive true player popular. Mother model new six.",1.7,411,False,68,2023-04-16
PROD_000235,Devolved systematic knowledgebase,Sports,Richards and Sons,448.57,179.4,Somebody get report owner network need. If smile choose eat wind term store. Time voice piece argue bit.,2.3,332,False,81,2023-01-06
PROD_000236,Persevering 5thgeneration forecast,Home,Adams-Cox,827.88,165.11,"Data that value base black. Enter office fall nothing long eye.
Never responsibility conference personal feel down body happen. Perhaps but travel event.",2.0,558,True,70,2025-04-06
PROD_000237,Compatible multi-tasking definition,Books,Castillo-Carroll,366.4,228.94,"Fund letter thousand. Employee science young agent.
Cell identify feel wear. Movement quite without vote final seat write. Tv place actually inside.",4.8,0,True,76,2022-06-09
PROD_000238,Upgradable content-based artificial intelligence,Electronics,Williams-Browning,522.42,496.74,"Travel lose newspaper specific.
Smile while memory dinner card understand. Never thousand enough reduce. Far head sure peace several pay sport.",2.2,307,True,40,2024-08-25
PROD_000239,Triple-buffered radical flexibility,Electronics,Hester-Keller,773.8,471.96,Time today reduce participant color. Agreement fire long light star. Support decade kitchen administration find personal American.,4.3,941,True,0,2025-03-08
PROD_000240,Ameliorated mobile Graphic Interface,Home,Robles Inc,362.09,73.51,"Matter can close carry. Stuff experience billion age size.
Old article give skill plan focus. Drive church everybody each significant shake.",2.5,596,True,38,2024-10-01
PROD_000241,Diverse mission-critical parallelism,Electronics,"Velez, Howell and Hart",574.77,286.69,Theory decade person many question once. Pattern central star professor fund also a. Energy bed now bank can century nor.,1.9,79,False,22,2024-10-20
PROD_000242,Expanded empowering installation,Home,Jones PLC,827.44,346.35,"Many large miss practice top you throw. Probably reality American bill west. Loss source south answer.
World scene quality article spring. Example more feeling information source.",3.3,929,True,38,2024-08-07
PROD_000243,Open-source modular knowledgebase,Electronics,Gibson-Castaneda,733.47,290.26,"Help ground federal pay around economic while. Party south receive dark. Blue anything high daughter.
Day state Mr rule career reality. Present these day quickly work. Wind mind from size let.",1.3,57,False,55,2024-11-16
PROD_000244,Polarized intermediate complexity,Home,Cantu Group,930.93,64.67,"Worker same effort career recently structure often. Approach on approach note stay.
Cold almost director something when medical. Law shoulder claim national Mr.",4.1,765,True,80,2024-11-26
PROD_000245,Adaptive 4thgeneration firmware,Home,Schmitt and Sons,63.58,264.57,"Within these scene heart. Half eight three skin maybe like maintain.
By range heart. Security pattern send. Majority serve well tough sea traditional.
Something finally baby low.",2.3,578,True,89,2022-06-20
PROD_000246,Pre-emptive optimizing process improvement,Clothing,Pham Ltd,161.66,338.45,Those glass food concern generation positive. Represent project cut by no hundred reach.,5.0,994,False,73,2024-09-01
PROD_000247,Networked eco-centric installation,Sports,"Smith, Carroll and Wood",99.17,218.81,"Bring trade despite only indeed could. End he avoid chance.
Identify order bank certainly remember tough late school. Newspaper service theory often network. Loss send medical paper impact cup occur.",4.1,151,True,60,2023-09-12
PROD_000248,Devolved disintermediate ability,Sports,Anderson LLC,747.85,276.34,"True she book hospital win send bed stay. During you prepare student guy generation. Above small community activity country individual.
Make health per eye short minute. Ability fear across window.",2.1,408,False,16,2024-09-24
PROD_000249,Enhanced tertiary intranet,Clothing,Hancock-Benitez,486.1,103.06,"Camera right skin stuff ball news. Actually drug wish about.
Forget program including catch attack friend truth whose. Report behind us maybe. Level somebody air vote.",2.6,585,True,94,2024-03-26
PROD_000250,Assimilated directional matrix,Sports,Robinson-Schultz,253.77,40.46,"Produce choice economy gas. Well form later better place answer south.
Hard may new. Smile call teach huge charge support performance.",4.1,331,True,52,2023-09-03
PROD_000251,Monitored client-driven migration,Home,Benjamin Ltd,371.6,99.29,Style pretty prevent remain. Project agency tax capital figure task oil. Couple system sport science floor.,2.4,671,True,21,2025-05-08
PROD_000252,Virtual high-level system engine,Books,"Sherman, Reyes and Smith",620.05,495.13,"Sister beautiful PM air him no force discover. Relationship manage among.
A cause total total. Nearly near want citizen serve. Pay how live without kitchen want current.",2.8,149,False,0,2023-03-19
PROD_000253,Organized dedicated policy,Clothing,Jones LLC,207.68,190.04,Opportunity sea game. Thus president manager whom responsibility anyone. Military me move around claim defense. Carry operation compare stuff.,4.0,873,True,6,2023-10-31
PROD_000254,Upgradable 24/7 analyzer,Clothing,Jones PLC,949.44,463.73,"Late mind visit. Hotel truth remember piece rock.
Suddenly send discussion off wide. Page bit blue most watch her attack.
Body where glass call. Pm pressure report grow attack beautiful total.",4.5,839,False,0,2024-06-01
PROD_000255,Horizontal asymmetric contingency,Electronics,Cunningham-Howell,312.06,238.24,"Rock direction sign. Newspaper report quickly would home. Already plan story success model visit. Thus sit story admit.
Partner wind nearly move expert protect present. Month member imagine.",2.3,757,True,66,2022-09-02
PROD_000256,Inverse bottom-line definition,Books,Summers Inc,553.3,313.41,Meeting argue just last success manage or. Need care almost direction two most work.,5.0,711,True,84,2023-05-27
PROD_000257,Versatile maximized architecture,Sports,Mclean LLC,53.04,89.31,"Live else guy reason finally director. She green rest win father specific. Mother work follow result pressure way of.
Staff half bit understand.",2.1,808,False,0,2024-12-20
PROD_000258,Public-key 24/7 portal,Electronics,"Harris, Moss and Riddle",75.92,331.88,Else food art service floor. Appear two federal seat general dark. Take since official each perhaps. Catch shoulder later fund first thing.,3.7,934,False,2,2025-02-27
PROD_000259,Multi-tiered optimal Local Area Network,Books,"King, Butler and Trujillo",868.73,326.46,"Light decide news prepare evidence night know that. Including benefit yard country.
Choice rich week bed some white value reduce. Member recent term share.",1.9,389,True,62,2022-07-07
PROD_000260,Diverse motivating collaboration,Sports,Wells-Nguyen,536.24,97.28,Across worker often sense week growth beyond stock. Once join cause crime single soldier arrive.,3.0,468,True,0,2024-05-20
PROD_000261,Implemented hybrid Local Area Network,Sports,"Lewis, Clark and Sanders",311.87,247.52,"System family among. Citizen hour throughout method add war red.
Participant middle special situation property. Number place item your effect. Teach quite director believe require.",4.0,18,False,45,2025-03-04
PROD_000262,Multi-tiered coherent complexity,Books,"Bell, Gallagher and Garcia",243.83,489.23,"Fine interview already room similar section science.
Term through fast opportunity. Kind partner friend memory.",3.0,831,True,49,2022-11-21
PROD_000263,Extended zero-defect moderator,Electronics,"Lee, Adams and King",944.69,474.81,"Baby attack understand reach series pattern hear.
Product agent get us air. Its behind must doctor develop current.",1.9,349,False,11,2024-06-11
PROD_000264,Reactive asynchronous help-desk,Home,"White, Hicks and Villarreal",525.5,340.61,"Book key hotel about. Indicate involve free animal. Service local direction Republican everything truth.
Thought far approach stand read. Half score collection economy.",4.5,702,True,73,2023-07-02
PROD_000265,Progressive 3rdgeneration core,Clothing,Galloway PLC,432.19,159.63,"Start explain in early campaign. Middle speech four. Senior evening provide talk.
Once student brother by deep major. Arrive appear education either.",3.4,459,True,17,2023-01-21
PROD_000266,Implemented zero-defect focus group,Sports,"Gray, Bennett and Smith",545.93,401.05,Hour role should surface some. Billion according black ability job.,4.5,316,True,98,2022-11-17
PROD_000267,Stand-alone neutral architecture,Clothing,Morgan Group,659.66,284.6,Church stop water discover party. Decide person within. Outside career recently support among.,1.6,69,True,18,2024-12-31
PROD_000268,Automated even-keeled task-force,Electronics,"Cisneros, Williams and Bird",767.77,440.67,Attack financial statement hope team offer watch. Participant behind upon professional significant. Again like training husband tough.,2.7,421,False,81,2024-03-12
PROD_000269,Networked foreground middleware,Books,White-Ortiz,160.43,98.03,"Budget enough teacher keep. True information usually book certainly foreign local.
Story network century show style coach make. Perhaps summer meeting treatment clearly officer purpose.",1.5,26,False,78,2023-01-15
PROD_000270,Progressive fresh-thinking hub,Clothing,"Powell, Snyder and Snyder",600.39,119.3,"Seem strong effort report suggest even. Able arrive safe already know.
Chance similar yet. Risk fine simply. Shoulder parent city in scientist computer.",1.1,81,False,77,2023-07-13
PROD_000271,Persistent next generation standardization,Home,"Ponce, Sanchez and Estrada",714.89,190.11,"Style follow wind seat. Great research area involve.
Build food research ability play little up. Either white citizen. West arrive family cut between radio.",4.4,503,False,24,2025-02-26
PROD_000272,Open-source maximized infrastructure,Clothing,Fitzpatrick and Sons,41.9,383.45,Century girl east. How worker discussion at. Finally inside though call industry step himself.,1.1,276,False,85,2023-10-01
PROD_000273,Open-architected fresh-thinking forecast,Clothing,"Smith, Young and Reid",760.19,37.74,"Physical present reality in. Everyone friend red war may its available.
Hand threat dream. Allow four difference break her southern tax. His ground strategy card book budget key.",4.7,449,False,58,2022-11-18
PROD_000274,Open-architected dynamic functionalities,Clothing,Johnson-Reyes,433.27,389.23,"Program as beautiful song week their. Reason guy tend customer there economy free.
Lawyer cup she economy. Morning after at year institution city.",3.4,844,False,50,2025-01-25
PROD_000275,Organized 6thgeneration support,Sports,"Hicks, Baird and Smith",939.74,288.11,"Real cold result authority next evening similar. Over whose economy language so few program.
Thus middle maintain unit. Across add surface food my.",3.1,656,True,57,2024-03-16
PROD_000276,Automated scalable contingency,Home,Strickland Inc,828.73,26.0,"Reduce nothing individual threat whether avoid. Town while stop simply certain.
Relationship right get model. However city lead speak perform.",5.0,531,False,5,2024-06-28
PROD_000277,Proactive transitional capability,Sports,Myers-Henry,393.51,383.75,Benefit age woman perhaps support field until now. Fact beyond establish always history then. There couple thought shoulder suggest age you.,4.9,194,False,38,2024-09-01
PROD_000278,Team-oriented fresh-thinking middleware,Books,Ray LLC,466.72,214.12,"Despite even spring evidence cell police middle.
Nation member operation address partner health party. Have trip increase center. Itself clear drive much bar community future.",3.5,55,True,82,2022-11-30
PROD_000279,Devolved multimedia adapter,Home,Valencia Group,99.53,252.83,"Inside nor guy. Card hit serve.
Lawyer since project everyone yes. Recent perform air describe wear.",1.7,599,True,41,2024-06-01
PROD_000280,Centralized explicit ability,Home,"Hall, Wright and Harmon",34.65,229.57,Hour society politics language. Skill send popular could value usually central. Deep difficult pattern care campaign those.,4.6,917,True,11,2024-01-13
PROD_000281,Quality-focused motivating framework,Books,Shepherd Inc,330.82,326.05,Former read reality onto night happy me. Find sell argue himself reduce reveal each operation.,3.8,167,True,0,2023-12-28
PROD_000282,Virtual non-volatile model,Home,Lewis-Perry,637.72,47.23,Thank for responsibility sister foreign. Career win boy night security common well forward.,3.8,744,True,48,2024-10-24
PROD_000283,Ameliorated 6thgeneration neural-net,Electronics,"Newman, Johnson and Johnson",770.57,456.57,"Mean imagine indicate around. Floor focus follow future.
Short seven north huge better recently provide source. Account require piece good reason too evening.",3.3,675,True,18,2025-05-31
PROD_000284,Customizable logistical capability,Clothing,"Marshall, Paul and Brown",771.46,30.4,Day wall foreign war leg. Quite marriage defense tough skin candidate sometimes.,2.2,747,False,23,2023-03-23
PROD_000285,Object-based hybrid strategy,Electronics,Munoz-Jimenez,899.55,480.41,"Charge suddenly true bed build very face. Happy institution prevent each writer.
Child serious hit writer true.",1.0,783,False,0,2023-09-05
PROD_000286,Synergistic asynchronous contingency,Home,"Gray, Green and Wolfe",856.85,274.03,"Prevent prove door side house. Free recently eight oil seven on. Picture student hotel yeah. Your article hour hope represent.
Grow baby else. Member thank whole special suggest area feel.",1.0,903,False,75,2024-09-22
PROD_000287,Right-sized foreground paradigm,Home,"Stephens, Alexander and Harrison",459.19,223.73,"Guess might once show listen worry. Turn his she us for region consumer state.
Anyone camera easy. Deep campaign meeting crime. Inside church economic serious such.",3.4,6,True,35,2024-08-06
PROD_000288,Multi-channeled incremental system engine,Sports,Kennedy Ltd,632.34,410.96,"Newspaper choose detail happy third real. News property thank together crime six. Should natural thank concern.
Ground century take money marriage. Risk create sort out improve machine.",1.8,189,True,0,2022-09-27
PROD_000289,Advanced bottom-line neural-net,Books,Barber-Williams,46.34,427.65,Various lose idea. Standard walk seek section full. Practice floor action ability.,3.7,858,False,11,2024-02-26
PROD_000290,Focused dedicated matrices,Electronics,"Shannon, Hernandez and Mcguire",117.79,496.9,"Maybe pattern avoid a. Machine deal though material explain. Anyone white boy face floor plant.
Candidate indicate person ten political interview organization. Green onto late with important.",1.6,291,True,95,2025-05-12
PROD_000291,Focused human-resource Internet solution,Sports,Harris-Alexander,366.58,22.74,Glass late federal section raise get pressure. Laugh each son partner education energy. Usually ask itself such floor fund economy live.,4.1,330,False,8,2024-09-12
PROD_000292,Programmable methodical groupware,Home,Vasquez-Harrell,844.87,37.14,"Camera cost organization police agreement. Food activity expert school. Discover focus hair allow role attack.
Field continue impact teacher school. Billion care particular east third area without.",2.9,124,False,52,2023-05-29
PROD_000293,Phased motivating projection,Sports,"Thomas, Miles and Alvarez",217.74,108.48,"System interesting answer use lay ok spend. Test suffer in notice price.
Special upon wish social senior rather factor. Product kitchen cell hundred war thus. Rather admit kid.",1.2,585,True,88,2024-06-11
PROD_000294,User-centric grid-enabled interface,Sports,Martinez-Ellis,934.54,493.21,Once style whatever watch kind. Soon firm bed these skill. Leave alone media may according forget firm.,2.1,623,False,73,2024-04-01
PROD_000295,Organized contextually-based architecture,Sports,Nichols LLC,360.3,69.21,"Drug last agreement use low want view. Last theory news choose eye. Color be list look able though read.
Stock more most. Impact end TV. Within interesting value middle buy.",3.3,532,False,23,2023-11-16
PROD_000296,Switchable clear-thinking help-desk,Sports,Carter and Sons,240.38,148.79,"Prepare scene nature ago music floor foot. Character garden mean series six picture another. Check wait administration.
Have smile same view. Oil bring her mission budget.",1.8,121,True,15,2022-07-23
PROD_000297,Integrated full-range neural-net,Clothing,Johnson-Davidson,801.56,499.5,Candidate local image through. Race unit his parent film drop join give. Watch turn different pretty deep design fall. That fight foot member.,2.7,341,False,81,2024-12-02
